{
    "clusterName": "testCluster",
    "instanceName": "clientName",
    "properties": {
        "hazelcast.client.heartbeat.interval": 1000,
        "hazelcast.client.heartbeat.timeout": 10000,
        "hazelcast.client.invocation.retry.pause.millis": 4000,
        "hazelcast.client.invocation.timeout.millis": 180000,
        "hazelcast.client.cloud.url": "https://hz.cloud",
        "hazelcast.client.statistics.enabled": true,
        "hazelcast.client.statistics.period.seconds": 4,
        "hazelcast.invalidation.reconciliation.interval.seconds": 50,
        "hazelcast.invalidation.max.tolerated.miss.count": 15,
        "hazelcast.invalidation.min.reconciliation.interval.seconds": 60,
        "hazelcast.logging.level": 3,
        "hazelcast.client.autopipelining.enabled": false,
        "hazelcast.client.autopipelining.threshold.bytes": 1024,
        "hazelcast.client.socket.no.delay": false,
        "hazelcast.client.shuffle.member.list": false
    },
    "clientLabels": [
        "label1",
        "label2"
    ],
    "network": {
        "clusterMembers": [
            "127.0.0.9",
            "127.0.0.2:5702"
        ],
        "smartRouting": false,
        "connectionTimeout": 6000,
        "ssl": {
            "enabled": true,
            "sslOptions": {
                "ca": "ca.pem",
                "cert": "cert.pem",
                "key": "key.pem",
                "servername": "foo.bar.com"
            }
        },
        "hazelcastCloud": {
            "discoveryToken": "EXAMPLE_TOKEN"
        }
    },
    "connectionStrategy": {
        "asyncStart": true,
        "reconnectMode": "async",
        "connectionRetry": {
            "initialBackoffMillis": 2000,
            "maxBackoffMillis": 60000,
            "multiplier": 3,
            "clusterConnectTimeoutMillis": 5000,
            "jitter": 0.5
        }
    },
    "serialization": {
        "defaultNumberType": "integer",
        "isBigEndian": false,
        "portableVersion": 1,
        "jsonStringDeserializationPolicy": "no_deserialization"
    },
    "nearCaches": {
        "nc-map": {
            "invalidateOnChange": false,
            "maxIdleSeconds": 2,
            "inMemoryFormat": "object",
            "timeToLiveSeconds": 3,
            "evictionPolicy": "lru",
            "evictionMaxSize": 3000,
            "evictionSamplingCount": 4,
            "evictionSamplingPoolSize": 8
        },
        "nc-map2": {
            "invalidateOnChange": false,
            "maxIdleSeconds": 2,
            "inMemoryFormat": "object",
            "timeToLiveSeconds": 3,
            "evictionPolicy": "lru",
            "evictionMaxSize": 3000,
            "evictionSamplingCount": 4,
            "evictionSamplingPoolSize": 8
        }
    },
    "reliableTopics": {
        "rt1": {
            "readBatchSize": 35,
            "overloadPolicy": "discard_newest"
        },
        "rt2": {
            "readBatchSize": 15,
            "overloadPolicy": "discard_newest"
        }
    },
    "flakeIdGenerators": {
        "flakeid": {
            "prefetchCount": 123,
            "prefetchValidityMillis": 150000
        },
        "flakeid2": {
            "prefetchCount": 1234,
            "prefetchValidityMillis": 1900000
        }
    },
    "loadBalancer": {
        "type": "random"
    }
}
